{
  "$schema": "http://json-schema.org/draft-07/schema#",
  "$id": "https://github.com/943fansi/evidence-suite/blob/main/shared/schemas/evidence_manifest.schema.json",
  "title": "Evidence Manifest (source-centric)",
  "description": "source-centric 互操作契约：由 finalize_draft.py --manifest 产出，映射 [Sx]→[n]→source_id/title/url + claims[]，保留证据 provenance。",
  "type": "object",
  "required": ["schema_version", "review_kind", "verification_mode", "finalized_at", "mapping"],
  "additionalProperties": true,
  "properties": {
    "schema_version": {
      "type": "string",
      "enum": ["0.1.0", "0.2.0"],
      "description": "manifest 契约版本；字段变更时必须递增。当前 0.2.0；旧版 0.1.0 由 migrate_manifest.py 向上迁移，validate_manifest.py 对旧版本仅告警不拒绝。"
    },
    "compatibility_notes": {
      "type": "string",
      "description": "本 manifest 兼容的 suite 版本区间 / 迁移说明（可选项）。"
    },
    "boundary_notice": {
      "type": "string",
      "description": "能力边界声明：套件只校验「引用原文是否支持论断」，不保证来源本身真实；locator 可能因 PDF 版本/扫描件/网页改版失效；未找到反证 ≠ 论断正确。"
    },
    "review_kind": {
      "type": "string",
      "enum": ["ai-internal", "ai-cross-model", "human-expert"],
      "description": "审查类型：ai-internal=同模型角色隔离（内部红队，不等同独立评审）；ai-cross-model=不同模型独立审查；human-expert=人类专家评审。"
    },
    "review_independence": {
      "type": "object",
      "description": "审查独立性细节：跨模型（ai-cross-model）也不等于独立——若两者共享相同检索结果/系统提示/reasoning prior，错误仍高度相关。如实记录以便下游判断 correlated failure 风险。",
      "properties": {
        "reviewer_model": { "type": "string" },
        "writer_model": { "type": "string" },
        "model_family": { "type": "string" },
        "context_shared": { "type": "boolean" },
        "evidence_shared": { "type": "boolean" },
        "human_involvement": { "type": "string", "enum": ["none", "partial", "full"] }
      }
    },
    "verification_mode": {
      "type": "string",
      "enum": ["static", "live"]
    },
    "finalized_at": {
      "type": "string",
      "format": "date"
    },
    "note": { "type": "string" },
    "mapping": {
      "type": "array",
      "items": {
        "type": "object",
        "required": ["citation", "mapped", "source_id"],
        "properties": {
          "citation": { "type": "string", "pattern": "^\\[[S]\\d+\\]$" },
          "mapped": { "type": "string", "pattern": "^\\[\\d+\\]$" },
          "source_id": { "type": "string", "pattern": "^S\\d+$" },
          "title": { "type": "string" },
          "url": { "type": "string" },
          "claims": {
            "type": "array",
            "items": {
              "type": "object",
              "properties": {
                "claim_text": { "type": "string" },
                "claim_class": { "type": "string", "enum": ["E", "M", "N", "L", "D", "C", "U", "J"] },
                "support_level": {
                  "type": "string",
                  "enum": ["direct", "strong_inference", "weak_inference", "context_only", "contradictory", "unsupported"]
                },
                "evidence_status": {
                  "type": "string",
                  "enum": ["verified", "supported", "partially_supported", "inferred", "contradicted", "unsupported", "unverified", "internal_confirm"]
                }
              },
              "required": ["claim_text", "support_level"]
            }
          }
        }
      }
    }
  }
}
