{
  "schema_version": "0.2.0",
  "review_kind": "ai-internal",
  "verification_mode": "static",
  "finalized_at": "2026-08-23",
  "note": "claim 级字段来自 06_evidence_map.json（--evidence-map 提供时自动合并）",
  "mapping": [
    {
      "citation": "[S1]",
      "mapped": "[1]",
      "source_id": "S1",
      "title": "设备老化管理综述",
      "url": "https://doi.org/10.xxxx/example1"
    },
    {
      "citation": "[S2]",
      "mapped": "[2]",
      "source_id": "S2",
      "title": "IEEE Std 323：设备鉴定流程",
      "url": "https://standards.ieee.org/example"
    },
    {
      "citation": "[S3]",
      "mapped": "[3]",
      "source_id": "S3",
      "title": "EPRI 设备老化管理技术报告",
      "url": "https://www.epri.com/example"
    }
  ],
  "review_independence": {
    "human_involvement": "none",
    "context_shared": true,
    "evidence_shared": true
  }
}